{
  "schema_version": "obs.capability_report.v1",
  "target_id": "local",
  "generated_at_unix_ms": 0,
  "capabilities": [
    {
      "capability_id": "linux.proc.cpu",
      "status": "supported",
      "required_privilege": "none",
      "safe_default": true,
      "reason": "available through bounded /proc/stat observation",
      "data_quality": {
        "dropped": false,
        "drop_count": 0,
        "throttled": false,
        "missing": [],
        "truncated": false,
        "clock_confidence": "medium",
        "notes": []
      }
    }
  ],
  "data_quality": {
    "dropped": false,
    "drop_count": 0,
    "throttled": false,
    "missing": [],
    "truncated": false,
    "clock_confidence": "medium",
    "notes": []
  }
}
